path,sentence,sentence_transcript,sentence_tokenized,sentence_transcript_tokenized,wer,cer,average WER,average CER
common_voice_it_19978226.mp3,"Inoltre viene utilizzato nel modellismo, per riprodurre molteplici oggetti, edifici, accessori.", Inoltre viene utilizzato nel modellismo per riprodurre molteplici oggetti ed edifici accessori.,"['inoltre', 'viene', 'utilizzato', 'nel', 'modellismo', ',', 'per', 'riprodurre', 'molteplici', 'oggetti', ',', 'edifici', ',', 'accessori', '.']","['inoltre', 'viene', 'utilizzato', 'nel', 'modellismo', 'per', 'riprodurre', 'molteplici', 'oggetti', 'ed', 'edifici', 'accessori', '.']",0.2,0.047058823529411764,,
common_voice_it_19978227.mp3,Le aurore polari non sono significative quanto su Giove e Saturno., Le orecolari non sono significative quanto Gio' e Saturno.,"['le', 'aurore', 'polari', 'non', 'sono', 'significative', 'quanto', 'su', 'giove', 'e', 'saturno', '.']","['le', 'orecolari', 'non', 'sono', 'significative', 'quanto', 'gio', ""'"", 'e', 'saturno', '.']",0.3333333333333333,0.14285714285714285,,
common_voice_it_20065328.mp3,Qui Scrooge deve affrontare la propria tomba e la morte di Tiny Tim., Qui Scrooge deve affrontare la propria tomba la morte di Tiny Tim.,"['qui', 'scrooge', 'deve', 'affrontare', 'la', 'propria', 'tomba', 'e', 'la', 'morte', 'di', 'tiny', 'tim', '.']","['qui', 'scrooge', 'deve', 'affrontare', 'la', 'propria', 'tomba', 'la', 'morte', 'di', 'tiny', 'tim', '.']",0.07142857142857142,0.017857142857142856,,
common_voice_it_20065330.mp3,Le sedi di gara sono state a San Pietroburgo., Le sede di gara sono state a San Pietroburgo.,"['le', 'sedi', 'di', 'gara', 'sono', 'state', 'a', 'san', 'pietroburgo', '.']","['le', 'sede', 'di', 'gara', 'sono', 'state', 'a', 'san', 'pietroburgo', '.']",0.1,0.02702702702702703,,
common_voice_it_22981322.mp3,Leopoldo Ruiz Moreno, Leopoldo Ruiz Moreno,"['leopoldo', 'ruiz', 'moreno']","['leopoldo', 'ruiz', 'moreno']",0.0,,,
common_voice_it_22981323.mp3,Si disse anche che Cameron fosse il cognome da nubile della madre., Si disse anche che Cameron fosse il cognome da nubile della madre.,"['si', 'disse', 'anche', 'che', 'cameron', 'fosse', 'il', 'cognome', 'da', 'nubile', 'della', 'madre', '.']","['si', 'disse', 'anche', 'che', 'cameron', 'fosse', 'il', 'cognome', 'da', 'nubile', 'della', 'madre', '.']",0.0,,,
common_voice_it_20091235.mp3,"Accortasi subito del delitto commesso, la donna si gettò disperata in un vicino burrone.", accortasi subito del delitto commesso la donna si gettò disperata in un vicino burrone,"['accortasi', 'subito', 'del', 'delitto', 'commesso', ',', 'la', 'donna', 'si', 'gettò', 'disperata', 'in', 'un', 'vicino', 'burrone', '.']","['accortasi', 'subito', 'del', 'delitto', 'commesso', 'la', 'donna', 'si', 'gettò', 'disperata', 'in', 'un', 'vicino', 'burrone']",0.125,0.02666666666666667,,
common_voice_it_20091236.mp3,La dirigenza rimase positivamente colpita da Aries e venne messo sotto contratto., La dirigente rimase positivamente colpita da Arias e venne messo sotto contratto.,"['la', 'dirigenza', 'rimase', 'positivamente', 'colpita', 'da', 'aries', 'e', 'venne', 'messo', 'sotto', 'contratto', '.']","['la', 'dirigente', 'rimase', 'positivamente', 'colpita', 'da', 'arias', 'e', 'venne', 'messo', 'sotto', 'contratto', '.']",0.15384615384615385,0.04285714285714286,,
common_voice_it_20023205.mp3,La seconda università pubblica è l'Università di Sarajevo Est., La seconda università pubblica è l'Università di Sarajevo Est.,"['la', 'seconda', 'università', 'pubblica', 'è', ""l'università"", 'di', 'sarajevo', 'est', '.']","['la', 'seconda', 'università', 'pubblica', 'è', ""l'università"", 'di', 'sarajevo', 'est', '.']",0.0,,,
common_voice_it_20023212.mp3,Copiosi resti di pitture restano nelle catacombe di Roma., copiosi resti di pitture restano nelle catacombe di Roma,"['copiosi', 'resti', 'di', 'pitture', 'restano', 'nelle', 'catacombe', 'di', 'roma', '.']","['copiosi', 'resti', 'di', 'pitture', 'restano', 'nelle', 'catacombe', 'di', 'roma']",0.1,0.02040816326530612,,
common_voice_it_19984198.mp3,"In definitiva, circa un terzo dei Valacchi fu ucciso."," In definitiva, circa un terzo dei valacchi fu ucciso.","['in', 'definitiva', ',', 'circa', 'un', 'terzo', 'dei', 'valacchi', 'fu', 'ucciso', '.']","['in', 'definitiva', ',', 'circa', 'un', 'terzo', 'dei', 'valacchi', 'fu', 'ucciso', '.']",0.0,,,
common_voice_it_19984201.mp3,Dopo aver catturato Fort George gli statunitensi vi costruirono le loro fortificazioni.," Dopo aver catturato Fort George, gli statunitensi ricostruirono le loro fortificazioni.","['dopo', 'aver', 'catturato', 'fort', 'george', 'gli', 'statunitensi', 'vi', 'costruirono', 'le', 'loro', 'fortificazioni', '.']","['dopo', 'aver', 'catturato', 'fort', 'george', ',', 'gli', 'statunitensi', 'ricostruirono', 'le', 'loro', 'fortificazioni', '.']",0.23076923076923078,0.02631578947368421,,
common_voice_it_30820232.mp3,I verbi non variano., I verbi non variano.,"['i', 'verbi', 'non', 'variano', '.']","['i', 'verbi', 'non', 'variano', '.']",0.0,,,
common_voice_it_30820287.mp3,Gli edifici del colle nei secoli subirono molti rimaneggiamenti., Gli edifici del colle nei secoli subirono molti rimaneggiamenti.,"['gli', 'edifici', 'del', 'colle', 'nei', 'secoli', 'subirono', 'molti', 'rimaneggiamenti', '.']","['gli', 'edifici', 'del', 'colle', 'nei', 'secoli', 'subirono', 'molti', 'rimaneggiamenti', '.']",0.0,,,
common_voice_it_19985413.mp3,La condanna gli venne in seguito ridotta a sei mesi., La condanna gli venne in seguito ridotta sei mesi.,"['la', 'condanna', 'gli', 'venne', 'in', 'seguito', 'ridotta', 'a', 'sei', 'mesi', '.']","['la', 'condanna', 'gli', 'venne', 'in', 'seguito', 'ridotta', 'sei', 'mesi', '.']",0.09090909090909091,0.023255813953488372,,
common_voice_it_19985417.mp3,La compagine giocava le sue partite di casa alla First Arena., La compagine giocava le sue partite di casa alla First Arena.,"['la', 'compagine', 'giocava', 'le', 'sue', 'partite', 'di', 'casa', 'alla', 'first', 'arena', '.']","['la', 'compagine', 'giocava', 'le', 'sue', 'partite', 'di', 'casa', 'alla', 'first', 'arena', '.']",0.0,,,
common_voice_it_21466830.mp3,Questo sbarramento è stato invece molto importante durante la prima guerra mondiale., Questo sbaramento è stato invece molto importante durante la Prima Guerra Mondiale.,"['questo', 'sbarramento', 'è', 'stato', 'invece', 'molto', 'importante', 'durante', 'la', 'prima', 'guerra', 'mondiale', '.']","['questo', 'sbaramento', 'è', 'stato', 'invece', 'molto', 'importante', 'durante', 'la', 'prima', 'guerra', 'mondiale', '.']",0.07692307692307693,0.0136986301369863,,
common_voice_it_21466832.mp3,"Dopo aver studiato teatro e recitazione, ha trovato impiego nel settore del doppiaggio.", Dopo aver studiato teatro e recitazione ha trovato impiego nel settore del doppiaggio.,"['dopo', 'aver', 'studiato', 'teatro', 'e', 'recitazione', ',', 'ha', 'trovato', 'impiego', 'nel', 'settore', 'del', 'doppiaggio', '.']","['dopo', 'aver', 'studiato', 'teatro', 'e', 'recitazione', 'ha', 'trovato', 'impiego', 'nel', 'settore', 'del', 'doppiaggio', '.']",0.06666666666666667,0.013333333333333334,,
common_voice_it_20078159.mp3,"Il ragno si riproduce in autunno, dopo la deposizione delle uova le femmine muoiono.", Il ragno si riproduce in autunno dopo la deposizione delle uova le femmine muoiono.,"['il', 'ragno', 'si', 'riproduce', 'in', 'autunno', ',', 'dopo', 'la', 'deposizione', 'delle', 'uova', 'le', 'femmine', 'muoiono', '.']","['il', 'ragno', 'si', 'riproduce', 'in', 'autunno', 'dopo', 'la', 'deposizione', 'delle', 'uova', 'le', 'femmine', 'muoiono', '.']",0.0625,0.014084507042253521,,
common_voice_it_20078160.mp3,Si giocava annualmente a Budapest in Ungheria., Si giocava annualmente a Budapest in Ungheria.,"['si', 'giocava', 'annualmente', 'a', 'budapest', 'in', 'ungheria', '.']","['si', 'giocava', 'annualmente', 'a', 'budapest', 'in', 'ungheria', '.']",0.0,,,
common_voice_it_23676689.mp3,Il suo scopo è essere una licenza generica per software distribuito su un network., Il suo scopo è essere una licenza generica per software distribuito su un network.,"['il', 'suo', 'scopo', 'è', 'essere', 'una', 'licenza', 'generica', 'per', 'software', 'distribuito', 'su', 'un', 'network', '.']","['il', 'suo', 'scopo', 'è', 'essere', 'una', 'licenza', 'generica', 'per', 'software', 'distribuito', 'su', 'un', 'network', '.']",0.0,,,
common_voice_it_23676693.mp3,La sua carriera è iniziata in Brasile dove ha giocato presso numerosi club.," La sua carriera è iniziata in Brasile, dove ha giocato presso numerosi club.","['la', 'sua', 'carriera', 'è', 'iniziata', 'in', 'brasile', 'dove', 'ha', 'giocato', 'presso', 'numerosi', 'club', '.']","['la', 'sua', 'carriera', 'è', 'iniziata', 'in', 'brasile', ',', 'dove', 'ha', 'giocato', 'presso', 'numerosi', 'club', '.']",0.07142857142857142,0.015873015873015872,,
common_voice_it_39862823.mp3,"Pertanto, vi sono autorizzate esclusivamente attività di ricerca scientifica e tecnica..", Pertanto vi sono autorizzate esclusivamente attività di ricerca scientifica e tecnica.,"['pertanto', ',', 'vi', 'sono', 'autorizzate', 'esclusivamente', 'attività', 'di', 'ricerca', 'scientifica', 'e', 'tecnica', '..']","['pertanto', 'vi', 'sono', 'autorizzate', 'esclusivamente', 'attività', 'di', 'ricerca', 'scientifica', 'e', 'tecnica', '.']",0.15384615384615385,0.02564102564102564,,
common_voice_it_39862857.mp3,Capoluogo era la città di Rovigo., Il capoluogo era la città di Rovigo.,"['capoluogo', 'era', 'la', 'città', 'di', 'rovigo', '.']","['il', 'capoluogo', 'era', 'la', 'città', 'di', 'rovigo', '.']",0.14285714285714285,0.07142857142857142,,
common_voice_it_20056915.mp3,Power Line Communication non è altro che la trasmissione di dati tramite linee elettriche., Overline Communication non è altro che la trasmissione di dati tramite linee elettriche,"['power', 'line', 'communication', 'non', 'è', 'altro', 'che', 'la', 'trasmissione', 'di', 'dati', 'tramite', 'linee', 'elettriche', '.']","['overline', 'communication', 'non', 'è', 'altro', 'che', 'la', 'trasmissione', 'di', 'dati', 'tramite', 'linee', 'elettriche']",0.2,0.03896103896103896,,
common_voice_it_20056920.mp3,"Secondogenita della coppia, ha un fratello maggiore, Johnny Horne, mentalmente ritardato."," Secondogenita della coppia, ha un fratello maggiore, Johnny Horn, mentalmente ritardato.","['secondogenita', 'della', 'coppia', ',', 'ha', 'un', 'fratello', 'maggiore', ',', 'johnny', 'horne', ',', 'mentalmente', 'ritardato', '.']","['secondogenita', 'della', 'coppia', ',', 'ha', 'un', 'fratello', 'maggiore', ',', 'johnny', 'horn', ',', 'mentalmente', 'ritardato', '.']",0.06666666666666667,0.012658227848101266,,
common_voice_it_20078962.mp3,"Per la dottrina più autorevole, l'impresa può essere di corpo o d'anima.", Per la dottrina più autorevole l'impresa può essere di corpo o d'anima.,"['per', 'la', 'dottrina', 'più', 'autorevole', ',', ""l'impresa"", 'può', 'essere', 'di', 'corpo', 'o', ""d'anima"", '.']","['per', 'la', 'dottrina', 'più', 'autorevole', ""l'impresa"", 'può', 'essere', 'di', 'corpo', 'o', ""d'anima"", '.']",0.07142857142857142,0.01639344262295082,,
common_voice_it_20078964.mp3,Éric Ramos, Eric Ramos,"['éric', 'ramos']","['eric', 'ramos']",0.5,0.1111111111111111,,
common_voice_it_20995893.mp3,Nella chiesa sono situate anche le statue di Sant'Anna e Santa Lucia., Nella chiesa sono situate anche le statue di Sant'Anna e Santa Lucia.,"['nella', 'chiesa', 'sono', 'situate', 'anche', 'le', 'statue', 'di', ""sant'anna"", 'e', 'santa', 'lucia', '.']","['nella', 'chiesa', 'sono', 'situate', 'anche', 'le', 'statue', 'di', ""sant'anna"", 'e', 'santa', 'lucia', '.']",0.0,,,
common_voice_it_20995896.mp3,In seguito ottenne un posto da docente di scienze politiche all'università., In seguito ottenne un posto da docente di scienze politiche all'università.,"['in', 'seguito', 'ottenne', 'un', 'posto', 'da', 'docente', 'di', 'scienze', 'politiche', ""all'università"", '.']","['in', 'seguito', 'ottenne', 'un', 'posto', 'da', 'docente', 'di', 'scienze', 'politiche', ""all'università"", '.']",0.0,,,
common_voice_it_20080366.mp3,Fu il terzo edificio costruito fuori dalle mura della Città Vecchia., Fu il terzo edificio costruito fuori dalle mura e dalle città vecchie.,"['fu', 'il', 'terzo', 'edificio', 'costruito', 'fuori', 'dalle', 'mura', 'della', 'città', 'vecchia', '.']","['fu', 'il', 'terzo', 'edificio', 'costruito', 'fuori', 'dalle', 'mura', 'e', 'dalle', 'città', 'vecchie', '.']",0.25,0.06896551724137931,,
common_voice_it_20080368.mp3,Perciò i dilettanti non venivano giudicati dal pubblico ma da una giuria., Perciò i direttanti non venivano giudicati dal pubblico ma da una giuria.,"['perciò', 'i', 'dilettanti', 'non', 'venivano', 'giudicati', 'dal', 'pubblico', 'ma', 'da', 'una', 'giuria', '.']","['perciò', 'i', 'direttanti', 'non', 'venivano', 'giudicati', 'dal', 'pubblico', 'ma', 'da', 'una', 'giuria', '.']",0.07692307692307693,0.016129032258064516,,
common_voice_it_20087152.mp3,Regia di Angelo Poli., Regia di Angelo Poli,"['regia', 'di', 'angelo', 'poli', '.']","['regia', 'di', 'angelo', 'poli']",0.2,0.05555555555555555,,
common_voice_it_20087153.mp3,Davide Cassani anche per i campionati europei di Plumelec., Davide Cassani anche per i campionati europei di Plam Helec,"['davide', 'cassani', 'anche', 'per', 'i', 'campionati', 'europei', 'di', 'plumelec', '.']","['davide', 'cassani', 'anche', 'per', 'i', 'campionati', 'europei', 'di', 'plam', 'helec']",0.2,0.06,,
common_voice_it_20042754.mp3,"Tale atteggiamento favorevole non è altrettanto ben canalizzato, però, all'interno del circuito elettorale."," Tale atteggiamento favorevole non è altrettanto men canalizzato, però all'interno del circuito elettorale.","['tale', 'atteggiamento', 'favorevole', 'non', 'è', 'altrettanto', 'ben', 'canalizzato', ',', 'però', ',', ""all'interno"", 'del', 'circuito', 'elettorale', '.']","['tale', 'atteggiamento', 'favorevole', 'non', 'è', 'altrettanto', 'men', 'canalizzato', ',', 'però', ""all'interno"", 'del', 'circuito', 'elettorale', '.']",0.125,0.021052631578947368,,
common_voice_it_20042756.mp3,Le condizioni generali del monumento sono tuttavia al momento ancora estremamente precarie., Le condizioni generali del monumento sono tuttavia al momento ancora estremamente precarie.,"['le', 'condizioni', 'generali', 'del', 'monumento', 'sono', 'tuttavia', 'al', 'momento', 'ancora', 'estremamente', 'precarie', '.']","['le', 'condizioni', 'generali', 'del', 'monumento', 'sono', 'tuttavia', 'al', 'momento', 'ancora', 'estremamente', 'precarie', '.']",0.0,,,
common_voice_it_20296584.mp3,"Dopo un breve tour, Wilson lascia la band e viene rimpiazzato da Richie Gonzales.", Dopo un breve tour Wilson lascia la band e viene rimpiazzato da Richie Gonzalez.,"['dopo', 'un', 'breve', 'tour', ',', 'wilson', 'lascia', 'la', 'band', 'e', 'viene', 'rimpiazzato', 'da', 'richie', 'gonzales', '.']","['dopo', 'un', 'breve', 'tour', 'wilson', 'lascia', 'la', 'band', 'e', 'viene', 'rimpiazzato', 'da', 'richie', 'gonzalez', '.']",0.125,0.029411764705882353,,
common_voice_it_20296586.mp3,Ospita le partite interne della Steaua Bucarest., Ospita le partite interne della Steaua Bucharest.,"['ospita', 'le', 'partite', 'interne', 'della', 'steaua', 'bucarest', '.']","['ospita', 'le', 'partite', 'interne', 'della', 'steaua', 'bucharest', '.']",0.125,0.023809523809523808,,
common_voice_it_20012075.mp3,Finita l'esperienza al San Fernando decide di abbandonare l'attività di allenatore., Finita l'esperienza San Fernando decide di abbandonare l'attività di allenatore.,"['finita', ""l'esperienza"", 'al', 'san', 'fernando', 'decide', 'di', 'abbandonare', ""l'attività"", 'di', 'allenatore', '.']","['finita', ""l'esperienza"", 'san', 'fernando', 'decide', 'di', 'abbandonare', ""l'attività"", 'di', 'allenatore', '.']",0.08333333333333333,0.0273972602739726,,
common_voice_it_20012076.mp3,"Di etnia albanese, nacque nel Kosovo, allora parte del Regno di Serbia."," L'etnia albanese nacque nel Kosovo, allora parte del Regno di Serbia.","['di', 'etnia', 'albanese', ',', 'nacque', 'nel', 'kosovo', ',', 'allora', 'parte', 'del', 'regno', 'di', 'serbia', '.']","[""l'etnia"", 'albanese', 'nacque', 'nel', 'kosovo', ',', 'allora', 'parte', 'del', 'regno', 'di', 'serbia', '.']",0.2,0.05,,
common_voice_it_38804565.mp3,Ogni cinque livelli viene regalata una carta Leader fino al livello ottanta., con i 5 livelli viene regalata una carta leader fino al livello 80,"['ogni', 'cinque', 'livelli', 'viene', 'regalata', 'una', 'carta', 'leader', 'fino', 'al', 'livello', 'ottanta', '.']","['con', 'i', '5', 'livelli', 'viene', 'regalata', 'una', 'carta', 'leader', 'fino', 'al', 'livello', '80']",0.38461538461538464,0.24615384615384617,,
common_voice_it_38804566.mp3,"Questa grande bandiera veniva chiamata ""l'aquila"".", Questa grande bandiera veniva chiamata l'Aquila.,"['questa', 'grande', 'bandiera', 'veniva', 'chiamata', '``', ""l'aquila"", ""''"", '.']","['questa', 'grande', 'bandiera', 'veniva', 'chiamata', ""l'aquila"", '.']",0.2222222222222222,0.0851063829787234,,
common_voice_it_40031192.mp3,Uno di essi era un parente di Antonio Pelle., Uno di essi era un parente di Antonio Pelle.,"['uno', 'di', 'essi', 'era', 'un', 'parente', 'di', 'antonio', 'pelle', '.']","['uno', 'di', 'essi', 'era', 'un', 'parente', 'di', 'antonio', 'pelle', '.']",0.0,,,
common_voice_it_40031196.mp3,"Milita in Eredivisie, la massima divisione del campionato olandese di calcio."," Milita in Eredivisie, la massima divisione del campionato olandese di calcio.","['milita', 'in', 'eredivisie', ',', 'la', 'massima', 'divisione', 'del', 'campionato', 'olandese', 'di', 'calcio', '.']","['milita', 'in', 'eredivisie', ',', 'la', 'massima', 'divisione', 'del', 'campionato', 'olandese', 'di', 'calcio', '.']",0.0,,,
common_voice_it_20067263.mp3,"Si trova al centro della Libia, nella regione storica del Fezzan.", Si trova al centro della Libia nella regione storica del Fezzan.,"['si', 'trova', 'al', 'centro', 'della', 'libia', ',', 'nella', 'regione', 'storica', 'del', 'fezzan', '.']","['si', 'trova', 'al', 'centro', 'della', 'libia', 'nella', 'regione', 'storica', 'del', 'fezzan', '.']",0.07692307692307693,0.01818181818181818,,
common_voice_it_20067265.mp3,"Con Aldo Trionfo scrive tre testi: ""Sandokan"", ""Margherita Gautier"", ""Ettore Fieramosca""."," Conaldo Trionfo scrive tre testi, Sandokan, Margherita Gautier, Ettore Fieramosca.","['con', 'aldo', 'trionfo', 'scrive', 'tre', 'testi', ':', '``', 'sandokan', ""''"", ',', '``', 'margherita', 'gautier', ""''"", ',', '``', 'ettore', 'fieramosca', ""''"", '.']","['conaldo', 'trionfo', 'scrive', 'tre', 'testi', ',', 'sandokan', ',', 'margherita', 'gautier', ',', 'ettore', 'fieramosca', '.']",0.42857142857142855,0.15294117647058825,,
common_voice_it_22393113.mp3,I visitatori turisti sono protetti da delle alte reti., I visitatori turisti sono protetti da delle alte reti.,"['i', 'visitatori', 'turisti', 'sono', 'protetti', 'da', 'delle', 'alte', 'reti', '.']","['i', 'visitatori', 'turisti', 'sono', 'protetti', 'da', 'delle', 'alte', 'reti', '.']",0.0,,,
common_voice_it_22393119.mp3,"L'assemblea nazionale è stata sciolta, Auf ha annunciato la convocazione di elezioni libere.", L'Assemblea Nazionale è stata sciolta. AUF ha annunciato la convocazione di elezioni libere.,"[""l'assemblea"", 'nazionale', 'è', 'stata', 'sciolta', ',', 'auf', 'ha', 'annunciato', 'la', 'convocazione', 'di', 'elezioni', 'libere', '.']","[""l'assemblea"", 'nazionale', 'è', 'stata', 'sciolta', '.', 'auf', 'ha', 'annunciato', 'la', 'convocazione', 'di', 'elezioni', 'libere', '.']",0.06666666666666667,0.0125,,
common_voice_it_24011440.mp3,Dopo il suo arrivo a Parigi divenne una modella internazionale molto popolare.," Dopo il suo arrivo a Parigi, divenne una modella internazionale molto popolare.","['dopo', 'il', 'suo', 'arrivo', 'a', 'parigi', 'divenne', 'una', 'modella', 'internazionale', 'molto', 'popolare', '.']","['dopo', 'il', 'suo', 'arrivo', 'a', 'parigi', ',', 'divenne', 'una', 'modella', 'internazionale', 'molto', 'popolare', '.']",0.07692307692307693,0.014925373134328358,,
common_voice_it_24011442.mp3,Quella che segue è l'evoluzione demografica della frazione di Prata., Quella che segue l'evoluzione demografica della fazione di Plata.,"['quella', 'che', 'segue', 'è', ""l'evoluzione"", 'demografica', 'della', 'frazione', 'di', 'prata', '.']","['quella', 'che', 'segue', ""l'evoluzione"", 'demografica', 'della', 'fazione', 'di', 'plata', '.']",0.2727272727272727,0.05084745762711865,,
common_voice_it_20075054.mp3,"Pietro e Paolo, Ospedale Pediatrico ""Bambino Gesù"" e Circolo di S. Pietro."," Pietro e Paolo, ospedale pediatrico Bambino Gesù e Circolo di San Pietro","['pietro', 'e', 'paolo', ',', 'ospedale', 'pediatrico', '``', 'bambino', 'gesù', ""''"", 'e', 'circolo', 'di', 's.', 'pietro', '.']","['pietro', 'e', 'paolo', ',', 'ospedale', 'pediatrico', 'bambino', 'gesù', 'e', 'circolo', 'di', 'san', 'pietro']",0.25,0.1076923076923077,,
common_voice_it_20075055.mp3,Si è laureato in medicina al Istituto Karolinska di Stoccolma dove successivamente ha insegnato.," Se è laureato in medicina all'Istituto Konoiska di Stoccolma, dove è successivamente insegnato.","['si', 'è', 'laureato', 'in', 'medicina', 'al', 'istituto', 'karolinska', 'di', 'stoccolma', 'dove', 'successivamente', 'ha', 'insegnato', '.']","['se', 'è', 'laureato', 'in', 'medicina', ""all'istituto"", 'konoiska', 'di', 'stoccolma', ',', 'dove', 'è', 'successivamente', 'insegnato', '.']",0.4666666666666667,0.13253012048192772,,
common_voice_it_20079390.mp3,Qualche anno più tardi divenne una sala cinematografica., qualche anno più tardi diventa una sala cinematografica,"['qualche', 'anno', 'più', 'tardi', 'divenne', 'una', 'sala', 'cinematografica', '.']","['qualche', 'anno', 'più', 'tardi', 'diventa', 'una', 'sala', 'cinematografica']",0.2222222222222222,0.061224489795918366,,
common_voice_it_20079393.mp3,Jesse torna a casa dal college in seguito alla morte del padre meccanico., Jess torna a casa dal college in seguito alla morte del padre meccanico.,"['jesse', 'torna', 'a', 'casa', 'dal', 'college', 'in', 'seguito', 'alla', 'morte', 'del', 'padre', 'meccanico', '.']","['jess', 'torna', 'a', 'casa', 'dal', 'college', 'in', 'seguito', 'alla', 'morte', 'del', 'padre', 'meccanico', '.']",0.07142857142857142,0.01639344262295082,,
common_voice_it_20042229.mp3,All'interno dello sbarramento c'è una centrale idroelettrica., All'interno dello sbaramento c'è una centrale idroelettrica,"[""all'interno"", 'dello', 'sbarramento', 'c', ""'"", 'è', 'una', 'centrale', 'idroelettrica', '.']","[""all'interno"", 'dello', 'sbaramento', 'c', ""'"", 'è', 'una', 'centrale', 'idroelettrica']",0.2,0.03636363636363636,,
common_voice_it_20042231.mp3,Questo è uno dei laghi più puliti al mondo., Questo è uno dei laghi più puliti al mondo.,"['questo', 'è', 'uno', 'dei', 'laghi', 'più', 'puliti', 'al', 'mondo', '.']","['questo', 'è', 'uno', 'dei', 'laghi', 'più', 'puliti', 'al', 'mondo', '.']",0.0,,,
common_voice_it_20287011.mp3,"Poco tempo dopo si riconciliarono, ma non durò a lungo.", Poco tempo dopo si riconciliarono ma non durò a lungo.,"['poco', 'tempo', 'dopo', 'si', 'riconciliarono', ',', 'ma', 'non', 'durò', 'a', 'lungo', '.']","['poco', 'tempo', 'dopo', 'si', 'riconciliarono', 'ma', 'non', 'durò', 'a', 'lungo', '.']",0.08333333333333333,0.021739130434782608,,
common_voice_it_20287013.mp3,Diverso il discorso quando il processo interessa le vene profonde., Diverso è il discorso quando il processo interessa le vede profonde.,"['diverso', 'il', 'discorso', 'quando', 'il', 'processo', 'interessa', 'le', 'vene', 'profonde', '.']","['diverso', 'è', 'il', 'discorso', 'quando', 'il', 'processo', 'interessa', 'le', 'vede', 'profonde', '.']",0.18181818181818182,0.03508771929824561,,
common_voice_it_20254358.mp3,La manovra è infatti possibile anche con un aliante., La manovra è infatti possibile anche con un agliante,"['la', 'manovra', 'è', 'infatti', 'possibile', 'anche', 'con', 'un', 'aliante', '.']","['la', 'manovra', 'è', 'infatti', 'possibile', 'anche', 'con', 'un', 'agliante']",0.2,0.045454545454545456,,
common_voice_it_20254365.mp3,I treni fermano a tutte le stazioni., I treni fermano a tutte le stazioni.,"['i', 'treni', 'fermano', 'a', 'tutte', 'le', 'stazioni', '.']","['i', 'treni', 'fermano', 'a', 'tutte', 'le', 'stazioni', '.']",0.0,,,
common_voice_it_20040271.mp3,Tutti questi interventi hanno rispettato i confini originali dell'edificio., Tutti questi interventi hanno rispettato i confini originali dell'edificio.,"['tutti', 'questi', 'interventi', 'hanno', 'rispettato', 'i', 'confini', 'originali', ""dell'edificio"", '.']","['tutti', 'questi', 'interventi', 'hanno', 'rispettato', 'i', 'confini', 'originali', ""dell'edificio"", '.']",0.0,,,
common_voice_it_20040278.mp3,"È considerato uno dei più antichi troodontidi noti, ma l'identità è dubbia."," È considerato uno dei più antichi Trudontiti noti, ma l'identità è dubbia.","['è', 'considerato', 'uno', 'dei', 'più', 'antichi', 'troodontidi', 'noti', ',', 'ma', ""l'identità"", 'è', 'dubbia', '.']","['è', 'considerato', 'uno', 'dei', 'più', 'antichi', 'trudontiti', 'noti', ',', 'ma', ""l'identità"", 'è', 'dubbia', '.']",0.07142857142857142,0.046875,,
common_voice_it_20014161.mp3,Rafael Morales, Grazie.,"['rafael', 'morales']","['grazie', '.']",1.0,0.8461538461538461,,
common_voice_it_20014163.mp3,L'anno mille, L'anno 1000,"[""l'anno"", 'mille']","[""l'anno"", '1000']",0.5,0.45454545454545453,,
common_voice_it_19999477.mp3,De Poli, De Poli,"['de', 'poli']","['de', 'poli']",0.0,,,
