path,sentence,sentence_transcript,sentence_tokenized,sentence_transcript_tokenized,wer,cer,average WER,average CER
common_voice_it_18795490.mp3,Si basò su Minix., Sibasso suminix,"['si', 'basò', 'su', 'minix', '.']","['sibasso', 'suminix']",1.0,0.21428571428571427,,
common_voice_it_18795491.mp3,Ha dimostrato di essere reattivo e di saper spiegare i fatti in modo critico., Ha dimostrato di essere reattivo e di saper spiegare i fatti in modo critico.,"['ha', 'dimostrato', 'di', 'essere', 'reattivo', 'e', 'di', 'saper', 'spiegare', 'i', 'fatti', 'in', 'modo', 'critico', '.']","['ha', 'dimostrato', 'di', 'essere', 'reattivo', 'e', 'di', 'saper', 'spiegare', 'i', 'fatti', 'in', 'modo', 'critico', '.']",0.0,,,
common_voice_it_20089092.mp3,Queste strutture sono state interpretate come aperture branchiali primitive., Queste strutture sono state interpretate come aperture branchiali primitive.,"['queste', 'strutture', 'sono', 'state', 'interpretate', 'come', 'aperture', 'branchiali', 'primitive', '.']","['queste', 'strutture', 'sono', 'state', 'interpretate', 'come', 'aperture', 'branchiali', 'primitive', '.']",0.0,,,
common_voice_it_20089101.mp3,Tuttavia il suo piano fallisce e lei e gli altri consiglieri vengono arrestati., Tuttavia il suo piano fallisce e lei e gli altri consiglieri vengono arrestati.,"['tuttavia', 'il', 'suo', 'piano', 'fallisce', 'e', 'lei', 'e', 'gli', 'altri', 'consiglieri', 'vengono', 'arrestati', '.']","['tuttavia', 'il', 'suo', 'piano', 'fallisce', 'e', 'lei', 'e', 'gli', 'altri', 'consiglieri', 'vengono', 'arrestati', '.']",0.0,,,
common_voice_it_20088889.mp3,Vennero sospesi i lavori parlamentari., Vennero sospesi i lavori parlamentari.,"['vennero', 'sospesi', 'i', 'lavori', 'parlamentari', '.']","['vennero', 'sospesi', 'i', 'lavori', 'parlamentari', '.']",0.0,,,
common_voice_it_20088890.mp3,Il capoluogo di contea è Bolivar., Il capoluogo di Contea è Bolivar.,"['il', 'capoluogo', 'di', 'contea', 'è', 'bolivar', '.']","['il', 'capoluogo', 'di', 'contea', 'è', 'bolivar', '.']",0.0,,,
common_voice_it_19987441.mp3,David Thomas Kelly, David Thomas Kelly,"['david', 'thomas', 'kelly']","['david', 'thomas', 'kelly']",0.0,,,
common_voice_it_19987448.mp3,Ciò ha portato anche ad un orientamento verso le esportazioni., Ciò ha portato anche ad un orientamento verso le esportazioni.,"['ciò', 'ha', 'portato', 'anche', 'ad', 'un', 'orientamento', 'verso', 'le', 'esportazioni', '.']","['ciò', 'ha', 'portato', 'anche', 'ad', 'un', 'orientamento', 'verso', 'le', 'esportazioni', '.']",0.0,,,
common_voice_it_27323388.mp3,L'impianto è dotato di due banchine laterali coperte da tettoie metalliche., L'impianto è dotato di due banchine laterali coperte da tettoie metalliche.,"[""l'impianto"", 'è', 'dotato', 'di', 'due', 'banchine', 'laterali', 'coperte', 'da', 'tettoie', 'metalliche', '.']","[""l'impianto"", 'è', 'dotato', 'di', 'due', 'banchine', 'laterali', 'coperte', 'da', 'tettoie', 'metalliche', '.']",0.0,,,
common_voice_it_27323389.mp3,"È un lupo dispotico, invidioso, e sleale.", è un lupo dispotico invidioso e sleale,"['è', 'un', 'lupo', 'dispotico', ',', 'invidioso', ',', 'e', 'sleale', '.']","['è', 'un', 'lupo', 'dispotico', 'invidioso', 'e', 'sleale']",0.3,0.08571428571428572,,
common_voice_it_19995598.mp3,Lascia la moglie Giovanna Morelli., Lascia la moglie Giovanna Morelli,"['lascia', 'la', 'moglie', 'giovanna', 'morelli', '.']","['lascia', 'la', 'moglie', 'giovanna', 'morelli']",0.16666666666666666,0.03333333333333333,,
common_voice_it_19995600.mp3,Il disegno della testata fu affidato ad Amerigo Bartoli., Il disegno della testata fu affidato ad Americo Bartoli.,"['il', 'disegno', 'della', 'testata', 'fu', 'affidato', 'ad', 'amerigo', 'bartoli', '.']","['il', 'disegno', 'della', 'testata', 'fu', 'affidato', 'ad', 'americo', 'bartoli', '.']",0.1,0.020833333333333332,,
common_voice_it_19973450.mp3,"Biancastra, consistente.", Biancastro consistente,"['biancastra', ',', 'consistente', '.']","['biancastro', 'consistente']",0.75,0.13043478260869565,,
common_voice_it_19973453.mp3,"I restanti sette episodi vennero trasmessi, insieme ai nuovi episodi, con la seconda stagione.", I restanti sette episodi vennero trasmessi insieme ai nuovi episodi con la seconda stagione.,"['i', 'restanti', 'sette', 'episodi', 'vennero', 'trasmessi', ',', 'insieme', 'ai', 'nuovi', 'episodi', ',', 'con', 'la', 'seconda', 'stagione', '.']","['i', 'restanti', 'sette', 'episodi', 'vennero', 'trasmessi', 'insieme', 'ai', 'nuovi', 'episodi', 'con', 'la', 'seconda', 'stagione', '.']",0.11764705882352941,0.024691358024691357,,
common_voice_it_19993648.mp3,Un comandamento teso a dimostrare lo stretto rapporto tra Dio ed il suo popolo., Un comandamento tesa di mostrare lo stretto rapporto tra Dio e Sua popola.,"['un', 'comandamento', 'teso', 'a', 'dimostrare', 'lo', 'stretto', 'rapporto', 'tra', 'dio', 'ed', 'il', 'suo', 'popolo', '.']","['un', 'comandamento', 'tesa', 'di', 'mostrare', 'lo', 'stretto', 'rapporto', 'tra', 'dio', 'e', 'sua', 'popola', '.']",0.4666666666666667,0.09090909090909091,,
common_voice_it_19993649.mp3,Successivamente accusa qualche infortunio., Successivamente accusa qualche infortunio.,"['successivamente', 'accusa', 'qualche', 'infortunio', '.']","['successivamente', 'accusa', 'qualche', 'infortunio', '.']",0.0,,,
common_voice_it_19974118.mp3,Morì senza essersi mai sposato., Morì senza essersi mai sposato.,"['morì', 'senza', 'essersi', 'mai', 'sposato', '.']","['morì', 'senza', 'essersi', 'mai', 'sposato', '.']",0.0,,,
common_voice_it_19974119.mp3,Il film inizia dalla fine., Il film inizia dalla fine,"['il', 'film', 'inizia', 'dalla', 'fine', '.']","['il', 'film', 'inizia', 'dalla', 'fine']",0.16666666666666666,0.045454545454545456,,
common_voice_it_20253576.mp3,"Si nutre di insetti, molluschi, semi e vegetali.", si nutre di insetti molluschi semi vegetali,"['si', 'nutre', 'di', 'insetti', ',', 'molluschi', ',', 'semi', 'e', 'vegetali', '.']","['si', 'nutre', 'di', 'insetti', 'molluschi', 'semi', 'vegetali']",0.36363636363636365,0.0975609756097561,,
common_voice_it_20253579.mp3,"Tornato a Malta, sceglie la strada della musica.", tornato a Malta sceglie la strada della musica,"['tornato', 'a', 'malta', ',', 'sceglie', 'la', 'strada', 'della', 'musica', '.']","['tornato', 'a', 'malta', 'sceglie', 'la', 'strada', 'della', 'musica']",0.2,0.04878048780487805,,
common_voice_it_22229669.mp3,Tale ipotesi è stata confutata da più fonti, Tale ipotesi è stata confrontata da più fonti.,"['tale', 'ipotesi', 'è', 'stata', 'confutata', 'da', 'più', 'fonti']","['tale', 'ipotesi', 'è', 'stata', 'confrontata', 'da', 'più', 'fonti', '.']",0.25,0.1111111111111111,,
common_voice_it_22245771.mp3,One Piece Wanted!," One piece of one, Dave!","['one', 'piece', 'wanted', '!']","['one', 'piece', 'of', 'one', ',', 'dave', '!']",1.0,0.5333333333333333,,
common_voice_it_28186633.mp3,"Particolarmente curata è la sezione intitolata ""Sport"".", Particolarmente curata è la sezione intitolata Sport,"['particolarmente', 'curata', 'è', 'la', 'sezione', 'intitolata', '``', 'sport', ""''"", '.']","['particolarmente', 'curata', 'è', 'la', 'sezione', 'intitolata', 'sport']",0.3,0.09803921568627451,,
common_voice_it_28186643.mp3,"Non è presente alcuna lesione fisica riconoscibile, a parte l'arrossamento del vestibolo."," Non è presente alcuna lesione fisica riconoscibile, a parte l'arrossamento del vestibolo.","['non', 'è', 'presente', 'alcuna', 'lesione', 'fisica', 'riconoscibile', ',', 'a', 'parte', ""l'arrossamento"", 'del', 'vestibolo', '.']","['non', 'è', 'presente', 'alcuna', 'lesione', 'fisica', 'riconoscibile', ',', 'a', 'parte', ""l'arrossamento"", 'del', 'vestibolo', '.']",0.0,,,
common_voice_it_20296106.mp3,"La produzione prebellica, tuttavia, seguiva processi metallurgici discutibili."," La produzione prebellica, tuttavia, segue processi metallurgici discutibili.","['la', 'produzione', 'prebellica', ',', 'tuttavia', ',', 'seguiva', 'processi', 'metallurgici', 'discutibili', '.']","['la', 'produzione', 'prebellica', ',', 'tuttavia', ',', 'segue', 'processi', 'metallurgici', 'discutibili', '.']",0.09090909090909091,0.04225352112676056,,
common_voice_it_20296109.mp3,Successivamente passa al campionato inglese acquistato dal Derby County., Successivamente passa il campagnato inglese acquistato dal Derby County.,"['successivamente', 'passa', 'al', 'campionato', 'inglese', 'acquistato', 'dal', 'derby', 'county', '.']","['successivamente', 'passa', 'il', 'campagnato', 'inglese', 'acquistato', 'dal', 'derby', 'county', '.']",0.2,0.046875,,
common_voice_it_20014740.mp3,I due sono anche membri di una banda musicale., I due sono anche membri di una banda musicale.,"['i', 'due', 'sono', 'anche', 'membri', 'di', 'una', 'banda', 'musicale', '.']","['i', 'due', 'sono', 'anche', 'membri', 'di', 'una', 'banda', 'musicale', '.']",0.0,,,
common_voice_it_20014741.mp3,Debutta diretta da Eduardo De Filippo., Debutta diretta da Edoardo De Filippo,"['debutta', 'diretta', 'da', 'eduardo', 'de', 'filippo', '.']","['debutta', 'diretta', 'da', 'edoardo', 'de', 'filippo']",0.2857142857142857,0.06060606060606061,,
common_voice_it_20311817.mp3,Il riflesso è assente anche nella torsione del testicolo., Il riflesso è assente anche nella torsione del testicolo.,"['il', 'riflesso', 'è', 'assente', 'anche', 'nella', 'torsione', 'del', 'testicolo', '.']","['il', 'riflesso', 'è', 'assente', 'anche', 'nella', 'torsione', 'del', 'testicolo', '.']",0.0,,,
common_voice_it_20311818.mp3,Infine si presenta distesa su una panca o su un muretto piccolo., Infine si presenta distesa su una panca o su un muretto piccolo.,"['infine', 'si', 'presenta', 'distesa', 'su', 'una', 'panca', 'o', 'su', 'un', 'muretto', 'piccolo', '.']","['infine', 'si', 'presenta', 'distesa', 'su', 'una', 'panca', 'o', 'su', 'un', 'muretto', 'piccolo', '.']",0.0,,,
common_voice_it_19432261.mp3,Qui c'era ben altro da fare che correre appresso agli indizi consueti., Qui c'era ben altro da fare che correre appresso agli indizi consueti.,"['qui', ""c'era"", 'ben', 'altro', 'da', 'fare', 'che', 'correre', 'appresso', 'agli', 'indizi', 'consueti', '.']","['qui', ""c'era"", 'ben', 'altro', 'da', 'fare', 'che', 'correre', 'appresso', 'agli', 'indizi', 'consueti', '.']",0.0,,,
common_voice_it_19432262.mp3,Venire al dunque., Venire al dunque.,"['venire', 'al', 'dunque', '.']","['venire', 'al', 'dunque', '.']",0.0,,,
common_voice_it_20071470.mp3,Cleveland ha un arancione simile a quello delle maglie dell'Università del Texas., Cleveland ha un arancione simile a quello delle maglie dell'Università del Texas.,"['cleveland', 'ha', 'un', 'arancione', 'simile', 'a', 'quello', 'delle', 'maglie', ""dell'università"", 'del', 'texas', '.']","['cleveland', 'ha', 'un', 'arancione', 'simile', 'a', 'quello', 'delle', 'maglie', ""dell'università"", 'del', 'texas', '.']",0.0,,,
common_voice_it_20071471.mp3,A richiesta era possibile avere il dispositivo della ruota libera., A richiesta era possibile avere il dispositivo della ruota libera.,"['a', 'richiesta', 'era', 'possibile', 'avere', 'il', 'dispositivo', 'della', 'ruota', 'libera', '.']","['a', 'richiesta', 'era', 'possibile', 'avere', 'il', 'dispositivo', 'della', 'ruota', 'libera', '.']",0.0,,,
common_voice_it_20019860.mp3,"Ne nascerà un triangolo di passioni, fatto di fughe, doppi giochi ed amori celati.", Ne nascerà un triangolo di passioni fatto di fughe e doppi giochi ed amori celati,"['ne', 'nascerà', 'un', 'triangolo', 'di', 'passioni', ',', 'fatto', 'di', 'fughe', ',', 'doppi', 'giochi', 'ed', 'amori', 'celati', '.']","['ne', 'nascerà', 'un', 'triangolo', 'di', 'passioni', 'fatto', 'di', 'fughe', 'e', 'doppi', 'giochi', 'ed', 'amori', 'celati']",0.17647058823529413,0.043478260869565216,,
common_voice_it_20019892.mp3,Cinque dei dodici mulini che formano il complesso sono tuttora funzionanti., 5 dei 12 mulini che formano il complesso sono tuttora funzionanti.,"['cinque', 'dei', 'dodici', 'mulini', 'che', 'formano', 'il', 'complesso', 'sono', 'tuttora', 'funzionanti', '.']","['5', 'dei', '12', 'mulini', 'che', 'formano', 'il', 'complesso', 'sono', 'tuttora', 'funzionanti', '.']",0.16666666666666666,0.18461538461538463,,
common_voice_it_20079828.mp3,"La specie è stata reperita in Tanzania, sull'isola di Zanzibar."," La specie è stata reperita in Tanzania, sull'isola di Zanzibar.","['la', 'specie', 'è', 'stata', 'reperita', 'in', 'tanzania', ',', ""sull'isola"", 'di', 'zanzibar', '.']","['la', 'specie', 'è', 'stata', 'reperita', 'in', 'tanzania', ',', ""sull'isola"", 'di', 'zanzibar', '.']",0.0,,,
common_voice_it_20079832.mp3,Di professione era un insegnante scolastico., Di professione ero un insegnante scolastico.,"['di', 'professione', 'era', 'un', 'insegnante', 'scolastico', '.']","['di', 'professione', 'ero', 'un', 'insegnante', 'scolastico', '.']",0.14285714285714285,0.02564102564102564,,
common_voice_it_18881768.mp3,"Egli ha dormito, ma sognava, sognava."," Egli ha dormito, ma sognava, sognava.","['egli', 'ha', 'dormito', ',', 'ma', 'sognava', ',', 'sognava', '.']","['egli', 'ha', 'dormito', ',', 'ma', 'sognava', ',', 'sognava', '.']",0.0,,,
common_voice_it_18881770.mp3,"Quella schiera di uomini, famiglie e personaggi popolavano la corte di Zorqun."," Quella schiera di uomini, famiglie e personaggi popolavano la corte di Zoruk.","['quella', 'schiera', 'di', 'uomini', ',', 'famiglie', 'e', 'personaggi', 'popolavano', 'la', 'corte', 'di', 'zorqun', '.']","['quella', 'schiera', 'di', 'uomini', ',', 'famiglie', 'e', 'personaggi', 'popolavano', 'la', 'corte', 'di', 'zoruk', '.']",0.07142857142857142,0.029850746268656716,,
common_voice_it_20042319.mp3,"Secondo i mormoni, ""Abaddon"" è uno dei titoli del demonio.", Secondo i mormoni Abaddon è uno dei titoli del demonio,"['secondo', 'i', 'mormoni', ',', '``', 'abaddon', ""''"", 'è', 'uno', 'dei', 'titoli', 'del', 'demonio', '.']","['secondo', 'i', 'mormoni', 'abaddon', 'è', 'uno', 'dei', 'titoli', 'del', 'demonio']",0.2857142857142857,0.11764705882352941,,
common_voice_it_20042322.mp3,Nonostante le due sconfitte al primo turno la dirigenza conferma coach Karl.," Nonostante le due sconfitte al primo turno, la dirigenza conferma coach Karl.","['nonostante', 'le', 'due', 'sconfitte', 'al', 'primo', 'turno', 'la', 'dirigenza', 'conferma', 'coach', 'karl', '.']","['nonostante', 'le', 'due', 'sconfitte', 'al', 'primo', 'turno', ',', 'la', 'dirigenza', 'conferma', 'coach', 'karl', '.']",0.07692307692307693,0.015384615384615385,,
common_voice_it_19970234.mp3,"È irritante, e se ingerito può causare nausea, vomito e diarrea."," È irritante e se ingerito può causare nausa, vomito e diarrea.","['è', 'irritante', ',', 'e', 'se', 'ingerito', 'può', 'causare', 'nausea', ',', 'vomito', 'e', 'diarrea', '.']","['è', 'irritante', 'e', 'se', 'ingerito', 'può', 'causare', 'nausa', ',', 'vomito', 'e', 'diarrea', '.']",0.14285714285714285,0.037037037037037035,,
common_voice_it_19970245.mp3,"In sole cinque settimane, ha ottenuto il Disco di Platino.", In sole cinque settimane ha ottenuto il disco di platino.,"['in', 'sole', 'cinque', 'settimane', ',', 'ha', 'ottenuto', 'il', 'disco', 'di', 'platino', '.']","['in', 'sole', 'cinque', 'settimane', 'ha', 'ottenuto', 'il', 'disco', 'di', 'platino', '.']",0.08333333333333333,0.02040816326530612,,
common_voice_it_20064694.mp3,"Interpretato da Norma Talmadge, il film viene considerato perduto."," Interpretato da Norma Talmage, il film viene considerato perduto.","['interpretato', 'da', 'norma', 'talmadge', ',', 'il', 'film', 'viene', 'considerato', 'perduto', '.']","['interpretato', 'da', 'norma', 'talmage', ',', 'il', 'film', 'viene', 'considerato', 'perduto', '.']",0.09090909090909091,0.017241379310344827,,
common_voice_it_20064695.mp3,Cominciò a recitare a teatro già da ragazzo., Cominciò a recitare a teatro già da ragazzo.,"['cominciò', 'a', 'recitare', 'a', 'teatro', 'già', 'da', 'ragazzo', '.']","['cominciò', 'a', 'recitare', 'a', 'teatro', 'già', 'da', 'ragazzo', '.']",0.0,,,
common_voice_it_23927231.mp3,La sua giunta venne però sciolta dall'affermarsi del fascismo., La sua giunta venne però sciolta dall'affermarsi del fascismo.,"['la', 'sua', 'giunta', 'venne', 'però', 'sciolta', ""dall'affermarsi"", 'del', 'fascismo', '.']","['la', 'sua', 'giunta', 'venne', 'però', 'sciolta', ""dall'affermarsi"", 'del', 'fascismo', '.']",0.0,,,
common_voice_it_23927232.mp3,In quel momento il suo stile divenne inconfondibile., In quel momento il suo stile divenne inconfondibile.,"['in', 'quel', 'momento', 'il', 'suo', 'stile', 'divenne', 'inconfondibile', '.']","['in', 'quel', 'momento', 'il', 'suo', 'stile', 'divenne', 'inconfondibile', '.']",0.0,,,
common_voice_it_38736293.mp3,"Alla morte del padre, il regno venne diviso equamente fra la sua progenie.", Alla morte del padre il regno venne diviso equamente fra la sua progenie.,"['alla', 'morte', 'del', 'padre', ',', 'il', 'regno', 'venne', 'diviso', 'equamente', 'fra', 'la', 'sua', 'progenie', '.']","['alla', 'morte', 'del', 'padre', 'il', 'regno', 'venne', 'diviso', 'equamente', 'fra', 'la', 'sua', 'progenie', '.']",0.06666666666666667,0.016129032258064516,,
common_voice_it_38736294.mp3,Anche in questo album Browne si avvale della collaborazione del chitarrista slide David Lindley., Anche in questo album Brown si avvale della collaborazione del chitarrista Slide David Lindley.,"['anche', 'in', 'questo', 'album', 'browne', 'si', 'avvale', 'della', 'collaborazione', 'del', 'chitarrista', 'slide', 'david', 'lindley', '.']","['anche', 'in', 'questo', 'album', 'brown', 'si', 'avvale', 'della', 'collaborazione', 'del', 'chitarrista', 'slide', 'david', 'lindley', '.']",0.06666666666666667,0.012048192771084338,,
common_voice_it_20074756.mp3,"In alcune parti gli affreschi sono frammentari, e talvolta è visibile la sinopia sottostante.", In alcune parti gli affreschi sono frammentari e talvolta è visibile la sinoppia sottostante.,"['in', 'alcune', 'parti', 'gli', 'affreschi', 'sono', 'frammentari', ',', 'e', 'talvolta', 'è', 'visibile', 'la', 'sinopia', 'sottostante', '.']","['in', 'alcune', 'parti', 'gli', 'affreschi', 'sono', 'frammentari', 'e', 'talvolta', 'è', 'visibile', 'la', 'sinoppia', 'sottostante', '.']",0.125,0.025,,
common_voice_it_20074757.mp3,Si hanno poi poche notizie certe., Si hanno poi poche notizie certe.,"['si', 'hanno', 'poi', 'poche', 'notizie', 'certe', '.']","['si', 'hanno', 'poi', 'poche', 'notizie', 'certe', '.']",0.0,,,
common_voice_it_26895834.mp3,È situata nel quartiere omonimo del capoluogo calabrese., È situata nel quartiere omonimo del capoluogo calabrese.,"['è', 'situata', 'nel', 'quartiere', 'omonimo', 'del', 'capoluogo', 'calabrese', '.']","['è', 'situata', 'nel', 'quartiere', 'omonimo', 'del', 'capoluogo', 'calabrese', '.']",0.0,,,
common_voice_it_26895837.mp3,"È dotata di quattro binari, tre passanti elettrificati ed uno tronco non elettrificato."," È dotata di quattro binari, tre passanti elettrificati ed uno tronco non elettrificato.","['è', 'dotata', 'di', 'quattro', 'binari', ',', 'tre', 'passanti', 'elettrificati', 'ed', 'uno', 'tronco', 'non', 'elettrificato', '.']","['è', 'dotata', 'di', 'quattro', 'binari', ',', 'tre', 'passanti', 'elettrificati', 'ed', 'uno', 'tronco', 'non', 'elettrificato', '.']",0.0,,,
common_voice_it_20256034.mp3,"Per l'elenco dei dati completi delle collaborazioni a Diabolik, si rimanda al Club ufficiale.", Per l'elenco dei dati completi delle collaborazioni di Abolic si rimanda al club ufficiale.,"['per', ""l'elenco"", 'dei', 'dati', 'completi', 'delle', 'collaborazioni', 'a', 'diabolik', ',', 'si', 'rimanda', 'al', 'club', 'ufficiale', '.']","['per', ""l'elenco"", 'dei', 'dati', 'completi', 'delle', 'collaborazioni', 'di', 'abolic', 'si', 'rimanda', 'al', 'club', 'ufficiale', '.']",0.1875,0.0375,,
common_voice_it_20256036.mp3,Al termine del campionato retrocede in I Divisione provinciale., Al termine del campionato retrocede in prima divisione provinciale.,"['al', 'termine', 'del', 'campionato', 'retrocede', 'in', 'i', 'divisione', 'provinciale', '.']","['al', 'termine', 'del', 'campionato', 'retrocede', 'in', 'prima', 'divisione', 'provinciale', '.']",0.1,0.07272727272727272,,
common_voice_it_19984679.mp3,Proseguì gli studi presso la Pontificia Università Gregoriana e all'Università La Sapienza di Roma., Proseguì gli studi presso la Pontificia Università Gregoriana e l'Università alla Sapienza di Roma.,"['proseguì', 'gli', 'studi', 'presso', 'la', 'pontificia', 'università', 'gregoriana', 'e', ""all'università"", 'la', 'sapienza', 'di', 'roma', '.']","['proseguì', 'gli', 'studi', 'presso', 'la', 'pontificia', 'università', 'gregoriana', 'e', ""l'università"", 'alla', 'sapienza', 'di', 'roma', '.']",0.13333333333333333,0.046511627906976744,,
common_voice_it_19984681.mp3,Le registrazioni sono state effettuate in California., le registrazioni sono state effettuate in California,"['le', 'registrazioni', 'sono', 'state', 'effettuate', 'in', 'california', '.']","['le', 'registrazioni', 'sono', 'state', 'effettuate', 'in', 'california']",0.125,0.02127659574468085,,
common_voice_it_19974844.mp3,Speciali distribuzioni esistono per piccole architetture per mainstream., fama distribuzione che sorvega Piedp gloss che chiesse aiuto alla maestria,"['speciali', 'distribuzioni', 'esistono', 'per', 'piccole', 'architetture', 'per', 'mainstream', '.']","['fama', 'distribuzione', 'che', 'sorvega', 'piedp', 'gloss', 'che', 'chiesse', 'aiuto', 'alla', 'maestria']",1.2222222222222223,0.6461538461538462,,
common_voice_it_19974845.mp3,Filippo quindi decise di prendere le armi e di assediare Deventer., Filippo quindi decise di prendere gli armi e di assiare per entro.,"['filippo', 'quindi', 'decise', 'di', 'prendere', 'le', 'armi', 'e', 'di', 'assediare', 'deventer', '.']","['filippo', 'quindi', 'decise', 'di', 'prendere', 'gli', 'armi', 'e', 'di', 'assiare', 'per', 'entro', '.']",0.3333333333333333,0.14285714285714285,,
common_voice_it_20312878.mp3,Lo può raggiungere solo il Capo di stato maggiore della difesa., Lo può raggiungere solo il capo di Stato Maggiore della Difesa.,"['lo', 'può', 'raggiungere', 'solo', 'il', 'capo', 'di', 'stato', 'maggiore', 'della', 'difesa', '.']","['lo', 'può', 'raggiungere', 'solo', 'il', 'capo', 'di', 'stato', 'maggiore', 'della', 'difesa', '.']",0.0,,,
common_voice_it_20312882.mp3,La sua duttilità gli permette di essere schierato anche come seconda punta o trequartista., La sua duttilità gli permette di essere schierato anche come seconda punta o trequartista.,"['la', 'sua', 'duttilità', 'gli', 'permette', 'di', 'essere', 'schierato', 'anche', 'come', 'seconda', 'punta', 'o', 'trequartista', '.']","['la', 'sua', 'duttilità', 'gli', 'permette', 'di', 'essere', 'schierato', 'anche', 'come', 'seconda', 'punta', 'o', 'trequartista', '.']",0.0,,,
common_voice_it_39975356.mp3,"Una settimana dopo, Alex lasciò il gruppo.", Una settimana dopo Alex lasciò il gruppo.,"['una', 'settimana', 'dopo', ',', 'alex', 'lasciò', 'il', 'gruppo', '.']","['una', 'settimana', 'dopo', 'alex', 'lasciò', 'il', 'gruppo', '.']",0.1111111111111111,0.027777777777777776,,
common_voice_it_39975357.mp3,Tale costume divenne regola nei documenti ufficiali a partire dal X secolo., Tale costume divenne regola nei documenti ufficiali a partire dal X secolo.,"['tale', 'costume', 'divenne', 'regola', 'nei', 'documenti', 'ufficiali', 'a', 'partire', 'dal', 'x', 'secolo', '.']","['tale', 'costume', 'divenne', 'regola', 'nei', 'documenti', 'ufficiali', 'a', 'partire', 'dal', 'x', 'secolo', '.']",0.0,,,
common_voice_it_20013833.mp3,"In Coppa Italia, la squadra labronica esce al terzo turno contro il Siena.", In Coppa Italia la squadra labbronica esce al terzo turno contro il Siena.,"['in', 'coppa', 'italia', ',', 'la', 'squadra', 'labronica', 'esce', 'al', 'terzo', 'turno', 'contro', 'il', 'siena', '.']","['in', 'coppa', 'italia', 'la', 'squadra', 'labbronica', 'esce', 'al', 'terzo', 'turno', 'contro', 'il', 'siena', '.']",0.13333333333333333,0.03225806451612903,,
common_voice_it_20013836.mp3,"In quanto rappresentazioni, i modelli non comprendono tutti gli aspetti della realtà."," In quanto a rappresentazioni, i modelli non comprendono tutti gli aspetti della realtà.","['in', 'quanto', 'rappresentazioni', ',', 'i', 'modelli', 'non', 'comprendono', 'tutti', 'gli', 'aspetti', 'della', 'realtà', '.']","['in', 'quanto', 'a', 'rappresentazioni', ',', 'i', 'modelli', 'non', 'comprendono', 'tutti', 'gli', 'aspetti', 'della', 'realtà', '.']",0.07142857142857142,0.013513513513513514,,
common_voice_it_20312676.mp3,Concetta Delle Donne Marangione., Concetta delle donne parangiona,"['concetta', 'delle', 'donne', 'marangione', '.']","['concetta', 'delle', 'donne', 'parangiona']",0.4,0.10344827586206896,,
common_voice_it_20312709.mp3,"Inoltre, le batterie della fotocamera si stanno esaurendo.", Inoltre le batterie della fotocamera si stanno instaurendo.,"['inoltre', ',', 'le', 'batterie', 'della', 'fotocamera', 'si', 'stanno', 'esaurendo', '.']","['inoltre', 'le', 'batterie', 'della', 'fotocamera', 'si', 'stanno', 'instaurendo', '.']",0.2,0.0784313725490196,,
common_voice_it_20019087.mp3,"Al centro, sul retro, spicca la cupola a base ottagonale."," Al centro, sul retro, spicca la cupola a base ottagonale.","['al', 'centro', ',', 'sul', 'retro', ',', 'spicca', 'la', 'cupola', 'a', 'base', 'ottagonale', '.']","['al', 'centro', ',', 'sul', 'retro', ',', 'spicca', 'la', 'cupola', 'a', 'base', 'ottagonale', '.']",0.0,,,
common_voice_it_20019090.mp3,La localizzazione dell'antica Inessa è incerta., La localizzazione dell'antica in essa è incerta.,"['la', 'localizzazione', ""dell'antica"", 'inessa', 'è', 'incerta', '.']","['la', 'localizzazione', ""dell'antica"", 'in', 'essa', 'è', 'incerta', '.']",0.2857142857142857,0.0,,
